smartctl 7.2 2020-12-30 r5155 [x86_64-linux-5.10.61-0-lts] (local build)
Copyright (C) 2002-20, Bruce Allen, Christian Franke, www.smartmontools.org

=== START OF INFORMATION SECTION ===
Model Number:                       SAMSUNG MZ1LW960HMJP-000MV
Serial Number:                      S3E4NX0J701640
Firmware Version:                   CXV82M1Q
PCI Vendor/Subsystem ID:            0x144d
IEEE OUI Identifier:                0x002538
Total NVM Capacity:                 960,197,124,096 [960 GB]
Unallocated NVM Capacity:           0
Controller ID:                      2
NVMe Version:                       1.2
Number of Namespaces:               1
Namespace 1 Size/Capacity:          960,197,124,096 [960 GB]
Namespace 1 Utilization:            3,494,866,944 [3.49 GB]
Namespace 1 Formatted LBA Size:     512
Local Time is:                      Tue Nov  9 01:03:40 2021 UTC
Firmware Updates (0x17):            3 Slots, Slot 1 R/O, no Reset required
Optional Admin Commands (0x000e):   Format Frmw_DL NS_Mngmt
Optional NVM Commands (0x001f):     Comp Wr_Unc DS_Mngmt Wr_Zero Sav/Sel_Feat
Log Page Attributes (0x03):         S/H_per_NS Cmd_Eff_Lg
Maximum Data Transfer Size:         128 Pages
Warning  Comp. Temp. Threshold:     83 Celsius
Critical Comp. Temp. Threshold:     84 Celsius
Namespace 1 Features (0x02):        NA_Fields

Supported Power States
St Op     Max   Active     Idle   RL RT WL WT  Ent_Lat  Ex_Lat
 0 +     9.00W       -        -    0  0  0  0        5       5

Supported LBA Sizes (NSID 0x1)
Id Fmt  Data  Metadt  Rel_Perf
 0 +     512       0         0
 1 -    4096       0         0

=== START OF SMART DATA SECTION ===
SMART overall-health self-assessment test result: PASSED

SMART/Health Information (NVMe Log 0x02)
Critical Warning:                   0x00
Temperature:                        50 Celsius
Available Spare:                    100%
Available Spare Threshold:          10%
Percentage Used:                    2%
Data Units Read:                    120,822,915 [61.8 TB]
Data Units Written:                 75,374,951 [38.5 TB]
Host Read Commands:                 4,814,744,979
Host Write Commands:                3,928,345,967
Controller Busy Time:               6,309
Power Cycles:                       296
Power On Hours:                     4,510
Unsafe Shutdowns:                   292
Media and Data Integrity Errors:    0
Error Information Log Entries:      258
Warning  Comp. Temperature Time:    0
Critical Comp. Temperature Time:    0
Temperature Sensor 1:               50 Celsius
Temperature Sensor 2:               70 Celsius

Error Information (NVMe Log 0x01, 16 of 64 entries)
Num   ErrCount  SQId   CmdId  Status  PELoc          LBA  NSID    VS
  0        258     0  0x001c  0x4004  0x028            0     0     -
  1        257     0  0x001c  0x4004  0x028            0     0     -
  2        256     0  0x001c  0x4004  0x028            0     0     -
  3        255     0  0x001c  0x4004  0x028            0     0     -
  4        254     0  0x001c  0x4004  0x028            0     0     -
  5        253     0  0x001c  0x4004  0x028            0     0     -
  6        252     0  0x001c  0x4004  0x028            0     0     -
  7        251     0  0x001c  0x4004  0x028            0     0     -
  8        250     0  0x001c  0x4004  0x028            0     0     -
  9        249     0  0x001c  0x4004  0x028            0     0     -
 10        248     0  0x001c  0x4004  0x028            0     0     -
 11        247     0  0x001c  0x4004  0x028            0     0     -
 12        246     0  0x001c  0x4004  0x028            0     0     -
 13        245     0  0x001c  0x4004  0x028            0     0     -
 14        244     0  0x001c  0x4004  0x028            0     0     -
 15        243     0  0x001c  0x4004  0x028            0     0     -
... (48 entries not read)

