smartctl 7.2 2020-12-30 r5155 [x86_64-linux-5.10.61-0-lts] (local build)
Copyright (C) 2002-20, Bruce Allen, Christian Franke, www.smartmontools.org

=== START OF INFORMATION SECTION ===
Model Number:                       SAMSUNG MZ1WV480HCGL-000MV
Serial Number:                      S1Y0NYAG200257
Firmware Version:                   BXU85M1Q
PCI Vendor/Subsystem ID:            0x144d
IEEE OUI Identifier:                0x002538
Controller ID:                      5197
NVMe Version:                       <1.2
Number of Namespaces:               1
Namespace 1 Size/Capacity:          480,103,981,056 [480 GB]
Namespace 1 Utilization:            2,317,361,152 [2.31 GB]
Namespace 1 Formatted LBA Size:     512
Namespace 1 IEEE EUI-64:            382500 2025702500
Local Time is:                      Tue Nov  9 01:05:40 2021 UTC
Firmware Updates (0x07):            3 Slots, Slot 1 R/O
Optional Admin Commands (0x0006):   Format Frmw_DL
Optional NVM Commands (0x0014):     DS_Mngmt Sav/Sel_Feat
Log Page Attributes (0x01):         S/H_per_NS

Supported Power States
St Op     Max   Active     Idle   RL RT WL WT  Ent_Lat  Ex_Lat
 0 +     6.00W       -        -    0  0  0  0       30      30

Supported LBA Sizes (NSID 0x1)
Id Fmt  Data  Metadt  Rel_Perf
 0 +     512       0         0

=== START OF SMART DATA SECTION ===
SMART overall-health self-assessment test result: PASSED

SMART/Health Information (NVMe Log 0x02)
Critical Warning:                   0x00
Temperature:                        47 Celsius
Available Spare:                    100%
Available Spare Threshold:          10%
Percentage Used:                    2%
Data Units Read:                    275,215,429 [140 TB]
Data Units Written:                 242,716,477 [124 TB]
Host Read Commands:                 17,645,193,819
Host Write Commands:                14,520,783,555
Controller Busy Time:               109,373,802,064
Power Cycles:                       295
Power On Hours:                     22,568
Unsafe Shutdowns:                   263
Media and Data Integrity Errors:    0
Error Information Log Entries:      1,019

Error Information (NVMe Log 0x01, 16 of 64 entries)
Num   ErrCount  SQId   CmdId  Status  PELoc          LBA  NSID    VS
  0       1019     0  0x0013  0x4004  0x000            0     0     -
  1       1018     0  0x000c  0x4212  0x028            0   255     -
  2       1017     0  0x0024  0x4202  0x000            0     0     -
  3       1016     0  0x0023  0x4202  0x000            0     0     -
  4       1015     0  0x001d  0x4202  0x000            0     0     -
  5       1014     0  0x001c  0x4004  0x000            0     0     -
  6       1013     0  0x0002  0x4004  0x000            0     0     -
  7       1012     0  0x001b  0x4004  0x000            0     0     -
  8       1011     0  0x001b  0x4004  0x000            0     0     -
  9       1010     0  0x001b  0x4004  0x000            0     0     -
 10       1009     0  0x001b  0x4004  0x000            0     0     -
 11       1008     0  0x001b  0x4004  0x000            0     0     -
 12       1007     0  0x001b  0x4004  0x000            0     0     -
 13       1006     0  0x001b  0x4004  0x000            0     0     -
 14       1005     0  0x001b  0x4004  0x000            0     0     -
 15       1004     0  0x001b  0x4004  0x000            0     0     -
... (48 entries not read)

